{
  "schema_version": "0.1.1",
  "framework_version": "0.5",
  "card_id": "tool-legal-citation-db-v1",
  "card_type": "tool_integration",
  "component_name": "Legal Citation Database Retrieval API",
  "version": "1.0",
  "owner": {
    "organisation_name": "Fictional Legal Research Provider",
    "contact": "support@example.org"
  },
  "status": "active",
  "last_reviewed_at": "2026-10-26",
  "summary": "Read-only legal citation retrieval API used by the closed-world BR-2 legal citation review assistant example profile.",
  "related_profile_ids": [
    "example-br2-closed-world-001"
  ],
  "authority_context": {
    "mandate_source": {
      "status": "not_established",
      "accountable_owner": "Fictional Legal Research Provider governance owner"
    },
    "principal_id": "fictional:legal-research-team",
    "agent_id": "fictional:citation-review-agent",
    "audience": "https://example.org/legal-citation-db",
    "delegated_scopes": ["citations:read"],
    "expires_at": "2026-11-26T00:00:00Z",
    "policy_snapshot_id": "fictional:read-only-policy-v1",
    "revocation_check": {
      "status": "not_checked",
      "mechanism": "Fictional token introspection; not exercised by this example"
    },
    "limits": ["Documentation example only: no credential or valid corporate/legal mandate is established.", "Expiry and revocation are declarations, not live admission checks."]
  },
  "evidence_refs": [
    {
      "evidence_type": "document",
      "uri": "https://example.org/docs/legal-citation-db-api",
      "notes": "Public API documentation describing read-only retrieval behavior."
    }
  ],
  "limits": [
    "This card documents the retrieval API surface only; it does not attest to the upstream dataset's legal accuracy or completeness.",
    "This card does not by itself prove replayability or evidence binding in the consuming system."
  ],
  "details": {
    "target_system": "Legal citation review assistant",
    "capability_mode": "read_only",
    "action_class_ceiling": "A1",
    "parameter_constraints_summary": "Query terms limited to citation and case-reference retrieval parameters; no write operations exposed.",
    "auth_model": "Service principal with read-only scoped token",
    "rollback_semantics": "Not applicable to retrieval-only calls; no external state mutation occurs.",
    "logging_replay_support": "Request/response pairs logged by the consuming system with deterministic query parameters for replay."
  }
}
